{"related_usc": [{"number": "112b", "detail": "(a)", "title": "1"}, {"number": "3349", "detail": "(a)", "title": "5"}, {"number": "801", "detail": "(a)(1)(A)", "title": "5"}, {"number": "1370", "detail": "(c)(1)", "title": "10"}, {"number": "501", "detail": "note", "title": "31"}, {"number": "1641", "detail": "(c)", "title": "50"}, {"number": "1703", "detail": "(c)", "title": "50"}], "related_laws": [{"isprivate": "false", "number": "403", "congress": "92"}, {"isprivate": "false", "number": "412", "congress": "94"}, {"isprivate": "false", "number": "223", "congress": "95"}, {"isprivate": "false", "number": "513", "congress": "96"}, {"isprivate": "false", "number": "106", "congress": "104"}, {"isprivate": "false", "number": "121", "congress": "104"}, {"isprivate": "false", "number": "270", "congress": "105"}, {"isprivate": "false", "number": "277", "congress": "105"}, {"isprivate": "false", "number": "458", "congress": "108"}], "related_statute": [{"volume": "90", "pages": "1257"}, {"volume": "91", "pages": "1627"}, {"volume": "110", "pages": "293"}, {"volume": "110", "pages": "868"}, {"volume": "112", "pages": "2382"}, {"volume": "112", "pages": "2681-614"}, {"volume": "118", "pages": "3807"}], "title": "EXECUTIVE COMMUNICATIONS, ETC.", "content": [{"text": "  Under clause 2 of rule XIV, executive communications were taken from \nthe Speaker's table and referred as follows:\n\n       3161. A letter from the Secretary, Department of Defense, \n     transmitting a letter on the approved retirement of Vice \n     Admiral Troy M. Shoemaker, United States Navy, and his \n     advancement to the grade of vice admiral on the retired list, \n     pursuant to 10 U.S.C. 1370(c)(1); Public Law 96-513, Sec. 112 \n     (as amended by Public Law 104-106, Sec. 502(b)); (110 Stat. \n     293); to the Committee on Armed Services.\n       3162. A letter from the Director, Regulations Policy and \n     Management Staff, FDA, Department of Health and Human \n     Services, transmitting the Department's final rule -- Listing \n     of Color Additives Exempt From Certification; Calcium \n     Carbonate [Docket No.: FDA-2016-C-2767] received November 13, \n     2017, pursuant to 5 U.S.C. 801(a)(1)(A); Public Law 104-121, \n     Sec. 251; (110 Stat. 868); to the Committee on Energy and \n     Commerce.\n       3163. A letter from the Director, Regulations Policy and \n     Management Staff, FDA, Department of Health and Human \n     Services, transmitting the Department's final rule -- Food \n     Additives Permitted in Feed and Drinking Water of Animals; \n     Ammonium Formate and Formic Acid [Docket No.: FDA-2014-F-\n     0988] received November 13, 2017, pursuant to 5 U.S.C. \n     801(a)(1)(A); Public Law 104-121, Sec. 251; (110 Stat. 868); \n     to the Committee on Energy and Commerce.\n       3164. A letter from the Secretary, Department of the \n     Treasury, transmitting a six-month periodic report on the \n     national emergency with respect to the Central African \n     Republic that was declared in Executive Order 13667 of May \n     12, 2014, pursuant to 50 U.S.C. 1641(c); Public Law 94-412, \n     Sec. 401(c); (90 Stat. 1257) and 50 U.S.C. 1703(c); Public \n     Law 95-223, Sec 204(c); (91 Stat. 1627); to the Committee on \n     Foreign Affairs.\n       3165. A letter from the Secretary, Department of the \n     Treasury, transmitting a six-month periodic report on the \n     national emergency with respect to Syria that was declared in \n     Executive Order 13338 of May 11, 2004, pursuant to 50 U.S.C. \n     1641(c); Public Law 94-412, Sec. 401(c); (90 Stat. 1257) and \n     50 U.S.C. 1703(c); Public Law 95-223, Sec 204(c); (91 Stat. \n     1627); to the Committee on Foreign Affairs.\n       3166. A letter from the Assistant Legal Adviser, Office of \n     Treaty Affairs, Department of State, transmitting reports \n     concerning international agreements other than treaties \n     entered into by the United States to be transmitted to the \n     Congress within the sixty-day period specified in the Case-\n     Zablocki Act, pursuant to 1 U.S.C. 112b(a); Public Law 92-\n     403, Sec. 1(a) (as amended by Public Law 108-458, Sec. \n     7121(b)); (118 Stat. 3807); to the Committee on Foreign \n     Affairs.\n       3167. A letter from the White House Liaison, Department of \n     Education, transmitting a notification of a nomination, \n     pursuant to 5 U.S.C. 3349(a); Public Law 105-277, 151(b); \n     (112 Stat. 2681-614); to the Committee on Oversight and \n     Government Reform.\n       3168. A letter from the White House Liaison, Department of \n     Education, transmitting a notification of a nomination, \n     pursuant to 5 U.S.C. 3349(a); Public Law 105-277, 151(b); \n     (112 Stat. 2681-614); to the Committee on Oversight and \n     Government Reform.\n       3169. A letter from the Acting Assistant Administrator, \n     Environmental Protection Agency, transmitting the Agency's FY \n     2016 Commercial and Inherently Governmental Inventories, \n     pursuant to 31 U.S.C. 501 note; Public Law 105-270, Sec. \n     2(c)(1)(A); (112 Stat. 2382); to the Committee on Oversight \n     and Government Reform.\n       3170. A letter from the Deputy Chief of Staff, Office of \n     Science and Technology Policy, Executive Office of the \n     President, transmitting a notification of a vacancy and \n     designation of acting officer, pursuant to 5 U.S.C. 3349(a); \n     Public Law 105-277, 151(b); (112 Stat. 2681-614); to the \n     Committee on Oversight and Government Reform.\n       3171. A letter from the Branch Chief, Endangered Species \n     Listing, U.S. Fish and Wildlife Service, Department of the \n     Interior, transmitting the Department's final rule -- \n     Endangered and Threatened Wildlife and Plants; Endangered \n     Species Status for Dalea carthagenensis var. floridana \n     (Florida Prairie-clover), and Threatened Species Status for \n     Sideroxylon reclinatum ssp. austrofloridense (Everglades \n     Bully), Digitaria pauciflora (Florida Pineland Crabgrass), \n     and Chamaesyce deltoidea ssp. pinetorum (Pineland Sandmat) \n     [Docket No.: FWS-R4-ES-2016-0090; 4500030113] (RIN: 1018-\n     BB48) received November 13, 2017, pursuant to 5 U.S.C. \n     801(a)(1)(A); Public Law 104-121, Sec. 251; (110 Stat. 868); \n     to the Committee on Natural Resources.\n       3172. A letter from the Chief, Branch of Listing Policy and \n     Support, U.S. Fish and Wildlife Service, Department of the \n     Interior, transmitting the Department's final rule -- \n     Endangered and Threatened Wildlife and Plants; Removing \n     Textual Descriptions of Critical Habitat Boundaries for \n     Plants on the Hawaiian Islands [Docket No.: FWS-HQ-ES-2015-\n     0009; 4500090023] (RIN: 1018-BA80) received November 13, \n     2017, pursuant to 5 U.S.C. 801(a)(1)(A); Public Law 104-121, \n     Sec. 251; (110 Stat. 868); to the Committee on Natural \n     Resources.\n       3173. A letter from the Wildlife Biologist, U.S. Fish and \n     Wildlife Service, Department of the Interior, transmitting \n     the Department's final rule -- Migratory Bird Hunting; \n     Approval of Corrosion-Inhibited Copper Shot as Nontoxic for \n     Waterfowl Hunting [Docket No.: FWS-HQ-MB-2015-0073; \n     FF09M21200-178-FXMB1231099BPP0] (RIN: 1018-BB06) received\n\n\n     November 13, 2017, pursuant to 5 U.S.C. 801(a)(1)(A); Public \n     Law 104-121, Sec. 251; (110 Stat. 868); to the Committee on \n     Natural Resources.\n       3174. A letter from the Conversation Policy Advisor, \n     National Wildlife Refuge System, U.S. Fish and Wildlife \n     Service, Department of the Interior, transmitting the \n     Department's final rule -- 2017-2018 Refuge-Specific Hunting \n     and Sport Fishing Regulations [Docket No.: FWS-HQ-NWRS-2017-\n     0005; FXRS12650900000-178-FF09R26000] (RIN: 1018-BB75) \n     received November 13, 2017, pursuant to 5 U.S.C. \n     801(a)(1)(A); Public Law 104-121, Sec. 251; (110 Stat. 868); \n     to the Committee on Natural Resources.\n       3175. A letter from the Assistant Secretary for Legislative \n     Affairs, Department of Homeland Security, transmitting a \n     legislative proposal, styled the ``Coast Guard Authorization \n     Act for Fiscal Year 2018''; to the Committee on \n     Transportation and Infrastructure.\n       3176. A letter from the Deputy Assistant Secretary for the \n     Veteran's Employment and Training Service, Department of \n     Labor, transmitting the Department's final rule -- HIRE Vets \n     Medallion Program [Docket No.: VETS-2017-0001] (RIN: 1293-\n     AA21) received November 13, 2017, pursuant to 5 U.S.C. \n     801(a)(1)(A); Public Law 104-121, Sec. 251; (110 Stat. 868); \n     to the Committee on Veterans' Affairs.\n       3177. A letter from the Office of the Secretary (00REG), \n     Department of Veterans Affairs, transmitting the Department's \n     final rule -- Ecclesiastical Endorsing Organizations (RIN: \n     2900-AP83) received November 13, 2017, pursuant to 5 U.S.C. \n     801(a)(1)(A); Public Law 104-121, Sec. 251; (110 Stat. 868); \n     to the Committee on Veterans' Affairs.\n", "kind": "Unknown", "speaker": "Unknown", "itemno": 0, "turn": -1}, {"kind": "linebreak", "speaker_bioguide": null, "text": "                          ____________________\n\n\n", "turn": -1, "speaker": "None", "itemno": 1}], "header": {"chamber": "House", "num": "186", "extension": false, "year": "2017", "vol": "163", "pages": "H9253-H9254", "wkday": "Tuesday", "day": "14", "month": "November"}, "doc_title": "EXECUTIVE COMMUNICATIONS, ETC.", "id": "CREC-2017-11-14-pt1-PgH9253-6"}