{"related_usc": [{"number": "112b", "detail": "(a)", "title": "1"}, {"number": "3349", "detail": "(a)", "title": "5"}, {"number": "7201", "title": "5"}, {"number": "801", "detail": "(a)(1)(A)", "title": "5"}, {"number": "1921c", "detail": "(h)(2)", "title": "48"}], "related_laws": [{"isprivate": "false", "number": "403", "congress": "92"}, {"isprivate": "false", "number": "121", "congress": "104"}, {"isprivate": "false", "number": "277", "congress": "105"}, {"isprivate": "false", "number": "188", "congress": "108"}, {"isprivate": "false", "number": "458", "congress": "108"}], "related_statute": [{"volume": "110", "pages": "868"}, {"volume": "112", "pages": "2681"}, {"volume": "112", "pages": "2681-614"}, {"volume": "117", "pages": "2737"}, {"volume": "118", "pages": "3807"}], "title": "EXECUTIVE COMMUNICATIONS, ETC.", "content": [{"text": "   Under clause 2 of rule XIV, executive communications were taken from \nthe Speaker's table and referred as follows:\n\n       3031. A letter from the Director, Regulatory Management \n     Division, Environmental Protection Agency, transmitting the \n     Agency's withdrawal of direct final rule--National Emission \n     Standards for Hazardous Air Pollutants for Wool Fiberglass \n     Manufacturing; Flame Attenuation Lines [EPA-HQ-OAR-2010-1042; \n     FRL-9770-08-OAR] (RIN: 2060-AT58) received October 20, 2017, \n     pursuant to 5 U.S.C. 801(a)(1)(A); Public Law 104-121, Sec. \n     251; (110 Stat. 868); to the Committee on Energy and \n     Commerce.\n       3032. A letter from the Director, Regulatory Management \n     Division, Environmental Protection Agency, transmitting the \n     Agency's direct final rule--Voluntary Consensus Standards \n     Update; Formaldehyde Emission Standards for Composite Wood \n     Products [EPA-HQ-OPPT-2017-0245; FRL-9962-84] (RIN: 2070-\n     AK36) received October 20, 2017, pursuant to 5 U.S.C. \n     801(a)(1)(A); Public Law 104-121, Sec. 251; (110 Stat. 868); \n     to the Committee on Energy and Commerce.\n       3033. A letter from the Director, Regulatory Management \n     Division, Environmental Protection Agency, transmitting the \n     Agency's direct final rule--Approval and Promulgation of \n     State Air Quality Plans for Designated Facilities and \n     Pollutants; City of Philadelphia; Control of Emissions from \n     Existing Sewage Sludge Incineration Units [EPA-R03-OAR-2017-\n     0509; FRL-9969-92-Region 3] received October 20, 2017, \n     pursuant to 5 U.S.C. 801(a)(1)(A); Public Law 104-121, Sec. \n     251; (110 Stat. 868); to the Committee on Energy and \n     Commerce.\n       3034. A letter from the Director, Regulatory Management \n     Division, Environmental Protection Agency, transmitting the \n     Agency's direct final rule--Approval and Promulgation of Air \n     Quality Implementation Plans; Pennsylvania; Pennsylvania's \n     Adoption of Control Techniques Guidelines for Automobile and \n     Light-Duty Truck Assembly Coatings [EPA-R03-OAR-2017-0342; \n     FRL-9969-83-Region 3] received October 20, 2017, pursuant to \n     5 U.S.C. 801(a)(1)(A); Public Law 104-121, Sec. 251; (110 \n     Stat. 868); to the Committee on Energy and Commerce.\n       3035. A letter from the Director, Regulatory Management \n     Division, Environmental Protection Agency, transmitting the \n     Agency's direct final rule--Air Plan Approval; Wisconsin; \n     2017 revisions to NR 400 and 406 [EPA-R05-OAR-2017-0280; FRL-\n     9969-89-Region 5] received October 20, 2017, pursuant to 5 \n     U.S.C. 801(a)(1)(A); Public Law 104-121, Sec. 251; (110 Stat. \n     868); to the Committee on Energy and Commerce.\n       3036. A letter from the Director, Regulatory Management \n     Division, Environmental Protection Agency, transmitting the \n     Agency's direct final rule--Air Plan Approval; Illinois; \n     Volatile Organic Compounds Definition [EPA-R05-OAR-2017-0323; \n     FRL-9970-17-Region 5] received October 25, 2017, pursuant to \n     5 U.S.C. 801(a)(1)(A); Public Law 104-121, Sec. 251; (110 \n     Stat. 868); to the Committee on Energy and Commerce.\n       3037. A letter from the Director, Regulatory Management \n     Division, Environmental Protection Agency, transmitting the \n     Agency's final rule--National Emission Standards for \n     Hazardous Air Pollutants: Publicly Owned Treatment Works \n     Residual Risk and Technology Review [EPA-HQ-OAR-2016-0490; \n     FRL-9969-95-OAR] (RIN: 2060-AS85) received October 20, 2017, \n     pursuant to 5 U.S.C. 801(a)(1)(A); Public Law 104-121, Sec. \n     251; (110 Stat. 868); to the Committee on Energy and \n     Commerce.\n       3038. A letter from the Director, Regulatory Management \n     Division, Environmental Protection Agency, transmitting the \n     Agency's final rule--Determination of Attainment by the \n     Attainment Date for the 2008 Ozone Standard; Philadelphia-\n     Wilmington-Atlantic City, PA-NJ-MD-DE Nonattainment\n\n\n     Area [EPA-R03-OAR-2016-0638; FRL-9969-93-Region 3] received \n     October 20, 2017, pursuant to 5 U.S.C. 801(a)(1)(A); Public \n     Law 104-121, Sec. 251; (110 Stat. 868); to the Committee on \n     Energy and Commerce.\n       3039. A letter from the Director, Regulatory Management \n     Division, Environmental Protection Agency, transmitting the \n     Agency's final rule--Hexythiazox; Pesticide Tolerances [EPA-\n     HQ-OPP-2017-0155; FRL-9968-12] received October 25, 2017, \n     pursuant to 5 U.S.C. 801(a)(1)(A); Public Law 104-121, Sec. \n     251; (110 Stat. 868); to the Committee on Energy and \n     Commerce.\n       3040. A letter from the Director, Regulatory Management \n     Division, Environmental Protection Agency, transmitting the \n     Agency's final rule--Bacillus amyloliquefaciens strain F727; \n     Exemption from the Requirement of a Tolerance [EPA-HQ-OPP-\n     2016-0348; FRL-9968-40] received October 25, 2017, pursuant \n     to 5 U.S.C. 801(a)(1)(A); Public Law 104-121, Sec. 251; (110 \n     Stat. 868); to the Committee on Energy and Commerce.\n       3041. A letter from the Director, Regulatory Management \n     Division, Environmental Protection Agency, transmitting the \n     Agency's final rule--Air Plan Approval; Minnesota; State \n     Board Requirements [EPA-R05-OAR-2016-0327; FRL-9970-14-Region \n     5] received October 25, 2017, pursuant to 5 U.S.C. \n     801(a)(1)(A); Public Law 104-121, Sec. 251; (110 Stat. 868); \n     to the Committee on Energy and Commerce.\n       3042. A letter from the Assistant Legal Adviser, Office of \n     Treaty Affairs, Department of State, transmitting reports \n     concerning international agreements other than treaties \n     entered into by the United States to be transmitted to the \n     Congress within the sixty-day period specified in the Case-\n     Zablocki Act, pursuant to 1 U.S.C. 112b(a); Public Law 92-\n     403, Sec. 1(a) (as amended by Public Law 108-458, Sec. \n     7121(b)); (118 Stat. 3807); to the Committee on Foreign \n     Affairs.\n       3043. A letter from the Deputy Assistant Secretary, Bureau \n     of Legislative Affairs, Department of State, transmitting \n     Transmittal No. DDTC 17-051, pursuant to Section 36(d) of the \n     Arms Export Control Act; to the Committee on Foreign Affairs.\n       3044. A letter from the Associate General Counsel for \n     General Law, Department of Homeland Security, transmitting a \n     notification of a nomination, pursuant to 5 U.S.C. 3349(a); \n     Public Law 105-277, 151(b); (112 Stat. 2681-614); to the \n     Committee on Oversight and Government Reform.\n       3045. A letter from the Associate General Counsel for \n     General Law, Department of Homeland Security, transmitting a \n     notification of an action on nomination and a notification of \n     a discontinuation of service in acting role, pursuant to 5 \n     U.S.C. 3349(a); Public Law 105-277, 151(b); (112 Stat. 2681-\n     614); to the Committee on Oversight and Government Reform.\n       3046. A letter from the Acting Director, Office of \n     Personnel Management, transmitting the Office's Federal Equal \n     Opportunity Recruitment Program Report for Fiscal Year 2015, \n     pursuant to 5 U.S.C. 7201; to the Committee on Oversight and \n     Government Reform.\n       3047. A letter from the Acting Director, Office of \n     Personnel Management, transmitting the Office's final rule--\n     Federal Employees' Retirement System; Government Costs (RIN: \n     3206-AN22) received October 25, 2017, pursuant to 5 U.S.C. \n     801(a)(1)(A); Public Law 104-121, Sec. 251; (110 Stat. 868); \n     to the Committee on Oversight and Government Reform.\n       3048. A letter from the Acting Director, Office of \n     Personnel Management, transmitting the Office's final rule--\n     Prevailing Rate Systems; Definition of Brown County, \n     Wisconsin, and Forsyth and Mecklenburg Counties, North \n     Carolina, to Nonappropriated Fund Federal Wage System Wage \n     Areas (RIN: 3206-AN50) received October 25, 2017, pursuant to \n     5 U.S.C. 801(a)(1)(A); Public Law 104-121, Sec. 251; (110 \n     Stat. 868); to the Committee on Oversight and Government \n     Reform.\n       3049. A letter from the Deputy Chief Counsel, Economic \n     Development Administration, Department of Commerce, \n     transmitting the Department's final rule--Elimination of \n     Regulations Implementing Community Trade Adjustment \n     Assistance Program [Docket No.: 170828819-7819-01] (RIN: \n     0610-AA70) received October 25, 2017, pursuant to 5 U.S.C. \n     801(a)(1)(A); Public Law 104-121, Sec. 251; (110 Stat. 868); \n     to the Committee on Ways and Means.\n       3050. A letter from the Chief, Trade and Commercial \n     Regulations Branch, U.S. Customs and Border Protection, \n     Department of Homeland Security, transmitting the \n     Department's final rule--Removing the Prohibition on the \n     Importation of Jadeite or Rubies Mined or Extracted from \n     Burma, and Articles of Jewelry Containing Jadeite or Rubies \n     Mined or Extracted from Burma [CBP Dec. 17-15] (RIN: 1515-\n     AE27) received October 25, 2017, pursuant to 5 U.S.C. \n     801(a)(1)(A); Public Law 104-121, Sec. 251; (110 Stat. 868); \n     to the Committee on Ways and Means.\n       3051. A letter from the Assistant Secretary for Insular \n     Areas, Department of the Interior, transmitting the report \n     ``Second Five-Year Review of the Compact of Free Association, \n     as Amended, Between the Governments of the United States and \n     the Federated States of Micronesia'' and the report ``Second \n     Five-Year Review of the Compact of Free Association, as \n     Amended, Between the Governments of the United States and the \n     Republic of the Marshall Islands'', pursuant to 48 U.S.C. \n     1921c(h)(2); Public Law 108-188, Sec. 104(h)(2); (117 Stat. \n     2737); jointly to the Committees on Natural Resources and \n     Foreign Affairs.\n", "kind": "Unknown", "speaker": "Unknown", "itemno": 0, "turn": -1}, {"kind": "linebreak", "speaker_bioguide": null, "text": "                          ____________________\n\n\n", "turn": -1, "speaker": "None", "itemno": 1}], "header": {"chamber": "House", "num": "177", "extension": false, "year": "2017", "vol": "163", "pages": "H8383-H8384", "wkday": "Wednesday", "day": "1", "month": "November"}, "doc_title": "EXECUTIVE COMMUNICATIONS, ETC.", "id": "CREC-2017-11-01-pt1-PgH8383-3"}