{"related_usc": [{"number": "3349", "detail": "(a)", "title": "5"}, {"number": "801", "detail": "(a)(1)(A)", "title": "5"}, {"number": "4332", "detail": "(b)(2)", "title": "38"}], "related_laws": [{"isprivate": "false", "number": "353", "congress": "103"}, {"isprivate": "false", "number": "121", "congress": "104"}, {"isprivate": "false", "number": "277", "congress": "105"}, {"isprivate": "false", "number": "389", "congress": "110"}, {"isprivate": "false", "number": "115", "congress": "114"}], "related_statute": [{"volume": "110", "pages": "868"}, {"volume": "112", "pages": "2681-614"}, {"volume": "122", "pages": "4165"}, {"volume": "129", "pages": "3133"}], "title": "EXECUTIVE COMMUNICATIONS, ETC.", "content": [{"text": "   Under clause 2 of rule XIV, executive communications were taken from \nthe Speaker's table and referred as follows:\n\n       3136. A letter from the Congressional Review Coordinator, \n     Animal and Plant Health Inspection Service, Department of \n     Agriculture, transmitting the Department's direct final rule \n     -- Black Stem Rust; Additions of Rust-Resistant Species and \n     Varieties [Docket No.: APHIS-2017-0049] received November 3, \n     2017, pursuant to 5 U.S.C. 801(a)(1)(A); Public Law 104-121, \n     Sec. 251; (110 Stat. 868); to the Committee on Agriculture.\n       3137. A letter from the Acting Director, Financial Crimes \n     Enforcement Network, Department of the Treasury, transmitting \n     the Department's final rule -- Imposition of Special Measure \n     against Bank of Dandong as a Financial Institution of Primary \n     Money Laundering Concern (RIN: 1506-AB38) received November \n     7, 2017, pursuant to 5 U.S.C. 801(a)(1)(A); Public Law 104-\n     121, Sec. 251; (110 Stat. 868); to the Committee on Financial \n     Services.\n       3138. A letter from the Assistant Secretary for Export \n     Administration, Bureau of Industry and Security, Department \n     of Commerce, transmitting the Department's final rule -- \n     Clarifications to the Export Administration Regulations for \n     the Use of License Exceptions [Docket No.: 160303181-6181-01] \n     (RIN: 0694-AG80) received November 7, 2017, pursuant to 5 \n     U.S.C. 801(a)(1)(A); Public Law 104-121, Sec. 251; (110 Stat. \n     868); to the Committee on Foreign Affairs.\n       3139. A letter from the Federal Liaison Officer, Patent and \n     Trademark Office, Department of Commerce, transmitting the \n     Department's final rule -- Rule on Attorney-Client Privilege \n     for Trials Before the Patent Trial and Appeal Board [Docket \n     No.: PTO-P-2016-0029] (RIN: 0651-AD10) received November 7, \n     2017, pursuant to 5 U.S.C. 801(a)(1)(A); Public Law 104-121, \n     Sec. 251; (110 Stat. 868); to the Committee on the Judiciary.\n       3140. A letter from the Executive Analyst (Political), \n     Department of Health and Human Services, transmitting a \n     notification of a nomination, pursuant to 5 U.S.C. 3349(a); \n     Public Law 105-277, 151(b); (112 Stat. 2681-614); to the \n     Committee on Oversight and Government Reform.\n       3141. A letter from the Senior Procurement Executive, \n     Office of Acquisition Policy, General Services \n     Administration, transmitting the Administration's summary \n     presentation of a final rule -- Federal Acquisition \n     Regulation; Federal Acquisition Circular 2005-96; \n     Introduction [Docket No.: FAR 2017-0051, Sequence No.: 1] \n     received November 7, 2017, pursuant to 5 U.S.C. 801(a)(1)(A); \n     Public Law 104-121, Sec. 251; (110 Stat. 868); to the \n     Committee on Oversight and Government Reform.\n       3142. A letter from the Chief, Publications and Regulations \n     Branch, Internal Revenue Service, transmitting the Service's \n     IRB only rule -- Relief for Victims of Hurricane Maria and \n     the California Wildfires (Announcement 2017-15) received \n     November 3, 2017, pursuant to 5 U.S.C. 801(a)(1)(A); Public \n     Law 104-121, Sec. 251; (110 Stat. 868); to the Committee on \n     Ways and Means.\n       3143. A letter from the Chief, Publications and Regulations \n     Branch, Internal Revenue Service, transmitting the Service's \n     IRB only rule -- Treatment Under Section 956(c) of Certain \n     Receivables Following Hurricane Irma or Hurricane Maria \n     [Notice 2017-68] received November 3, 2017, pursuant to 5 \n     U.S.C. 801(a)(1)(A); Public Law 104-121, Sec. 251; (110 Stat. \n     868); to the Committee on Ways and Means.\n       3144. A letter from the Acting Assistant Secretary for \n     Legislation, Department of Health and Human Services, \n     transmitting a report entitled, ``Episodic Alternative \n     Payment Model (APM) for Radiation Therapy Services'', \n     pursuant to Public Law 114-115, Sec. 3(b); (129 Stat. 3133); \n     jointly to the Committees on Energy and Commerce and Ways and \n     Means.\n       3145. A letter from the Assistant Attorney General, \n     Department of Justice, transmitting the Attorney General's \n     Fourth Quarterly Report of FY 2017 on the Uniformed Services \n     Employment and Reemployment Rights Act of 1994, pursuant to \n     38 U.S.C. 4332(b)(2); Public Law 103-353, Sec. 2(a) (as added \n     by Public Law 110-389, Sec. 312(c)); (122 Stat. 4165); \n     jointly to the Committees on the Judiciary and Veterans' \n     Affairs.\n", "kind": "Unknown", "speaker": "Unknown", "itemno": 0, "turn": -1}, {"kind": "linebreak", "speaker_bioguide": null, "text": "                          ____________________\n\n\n", "turn": -1, "speaker": "None", "itemno": 1}], "header": {"chamber": "House", "num": "183", "extension": false, "year": "2017", "vol": "163", "pages": "H8694", "wkday": "Thursday", "day": "9", "month": "November"}, "doc_title": "EXECUTIVE COMMUNICATIONS, ETC.", "id": "CREC-2017-11-09-pt1-PgH8694-5"}