{"related_usc": [{"number": "3349", "detail": "(a)", "title": "5"}, {"number": "801", "detail": "(a)(1)(A)", "title": "5"}, {"number": "501", "detail": "note", "title": "31"}, {"number": "3325", "detail": "(a)(1)", "title": "38"}], "related_laws": [{"isprivate": "false", "number": "121", "congress": "104"}, {"isprivate": "false", "number": "270", "congress": "105"}, {"isprivate": "false", "number": "277", "congress": "105"}, {"isprivate": "false", "number": "154", "congress": "112"}], "related_statute": [{"volume": "110", "pages": "868"}, {"volume": "112", "pages": "2382"}, {"volume": "112", "pages": "2681-614"}, {"volume": "126", "pages": "1189"}], "title": "EXECUTIVE COMMUNICATIONS, ETC.", "content": [{"text": "   Under clause 2 of rule XIV, executive communications were taken from \nthe Speaker's table and referred as follows:\n\n       3114. A letter from the Deputy Assistant Secretary, Bureau \n     of Legislative Affairs, Department of State, transmitting \n     Transmittal No. DDTC 17-069, pursuant to the reporting \n     requirements of Section 36(c) of the Arms Export Control Act; \n     to the Committee on Foreign Affairs.\n       3115. A letter from the Deputy Assistant Secretary, Bureau \n     of Legislative Affairs, Department of State, transmitting \n     Transmittal No. DDTC 17-038, pursuant to the reporting \n     requirements of Section 36(c) of the Arms Export Control Act; \n     to the Committee on Foreign Affairs.\n\n\n\n       3116. A letter from the Deputy Assistant Secretary, Bureau \n     of Legislative Affairs, Department of State, transmitting \n     Transmittal No. DDTC 17-040, pursuant to the reporting \n     requirements of Section 36(c) of the Arms Export Control Act; \n     to the Committee on Foreign Affairs.\n       3117. A letter from the Deputy Assistant Secretary, Bureau \n     of Legislative Affairs, Department of State, transmitting \n     Transmittal No. DDTC 17-081, pursuant to the reporting \n     requirements of Section 36(c) of the Arms Export Control Act; \n     to the Committee on Foreign Affairs.\n       3118. A letter from the Deputy Assistant Secretary, Bureau \n     of Legislative Affairs, Department of State, transmitting \n     Transmittal No. DDTC 17-059, pursuant to the reporting \n     requirements of Section 36(c) of the Arms Export Control Act; \n     to the Committee on Foreign Affairs.\n       3119. A letter from the Deputy Assistant Secretary, Bureau \n     of Legislative Affairs, Department of State, transmitting \n     Transmittal No. DDTC 17-072, pursuant to Section 36(d) of the \n     Arms Export Control Act; to the Committee on Foreign Affairs.\n       3120. A letter from the Deputy Assistant Secretary, Bureau \n     of Legislative Affairs, Department of State, transmitting \n     Transmittal No. DDTC 17-022, pursuant to Section 36(d) of the \n     Arms Export Control Act; to the Committee on Foreign Affairs.\n       3121. A letter from the Deputy Assistant Secretary, Bureau \n     of Legislative Affairs, Department of State, transmitting \n     Transmittal No. DDTC 17-026, pursuant to Section 36(d) of the \n     Arms Export Control Act; to the Committee on Foreign Affairs.\n       3122. A letter from the Deputy Assistant Secretary, Bureau \n     of Legislative Affairs, Department of State, transmitting \n     Transmittal No. DDTC 17-061, pursuant to the reporting \n     requirements of Section 36(c) and 36(d) of the Arms Export \n     Control Act; to the Committee on Foreign Affairs.\n       3123. A letter from the Deputy Assistant Secretary, Bureau \n     of Legislative Affairs, Department of State, transmitting \n     Transmittal No. DDTC 17-048, pursuant to the reporting \n     requirements of Section 36(c) and 36(d) of the Arms Export \n     Control Act; to the Committee on Foreign Affairs.\n       3124. A letter from the Director, Office of Management, \n     Department of Energy, transmitting the Department's annual \n     list of Government activities that are and are not inherently \n     governmental in nature, pursuant to 31 U.S.C. 501 note; \n     Public Law 105-270, Sec. 2(c)(1)(A); (112 Stat. 2382); to the \n     Committee on Oversight and Government Reform.\n       3125. A letter from the Assistant General Counsel (GLER), \n     Department of the Treasury, transmitting a notification of a \n     vacancy, designation of acting officer, nomination, and \n     action on nomination, pursuant to 5 U.S.C. 3349(a); Public \n     Law 105-277, 151(b); (112 Stat. 2681-614); to the Committee \n     on Oversight and Government Reform.\n       3126. A letter from the Chairman, National Credit Union \n     Administration, transmitting the Administration's Inspector \n     General's semi-annual report for April 1, 2017, through \n     September 30, 2017, pursuant to Sec. 5(b) of the Inspector \n     General Act of 1978, as amended; to the Committee on \n     Oversight and Government Reform.\n       3127. A letter from the Acting Under Secretary, Personnel \n     and Readiness, Department of Defense, transmitting the \n     Department's annual report concerning the Post-9/11 \n     Educational Assistance Program, pursuant to 38 U.S.C. \n     3325(a)(1); Public Law 112-154, Sec. 402(a)(1); (126 Stat. \n     1189); jointly to the Committees on Armed Services and \n     Veterans' Affairs.\n       3128. A letter from the Deputy Director, ODRM, Centers for \n     Medicare and Medicaid Services, Department of Health and \n     Human Services, transmitting the Department's Major final \n     rule -- Medicare Program; Revisions to Payment Policies under \n     the Physician Fee Schedule and Other Revisions to Part B for \n     CY 2018; Medicare Shared Savings Program Requirements; and \n     Medicare Diabetes Prevention Program [CMS-1676-F] (RIN: 0938-\n     AT02) received November 3, 2017, pursuant to 5 U.S.C. \n     801(a)(1)(A); Public Law 104-121, Sec. 251; (110 Stat. 868); \n     jointly to the Committees on Energy and Commerce and Ways and \n     Means.\n       3129. A letter from the Deputy Director, ODRM, Centers for \n     Medicare and Medicaid Services, Department of Health and \n     Human Services, transmitting the Department's Major final \n     rule -- Medicare Program: Hospital Outpatient Prospective \n     Payment and Ambulatory Surgical Center Payment Systems and \n     Quality Reporting Programs [CMS-1678-FC] (RIN: 0938-AT03) \n     received November 3, 2017, pursuant to 5 U.S.C. 801(a)(1)(A); \n     Public Law 104-121, Sec. 251; (110 Stat. 868); jointly to the \n     Committees on Energy and Commerce and Ways and Means.\n       3130. A letter from the Administrator, Environmental \n     Protection Agency, transmitting the Agency's report entitled, \n     ``Mississippi River/Gulf of Mexico Watershed Nutrient Task \n     Force: 2017 Report to Congress'', pursuant to Sec. 604 of the \n     Harmful Algal Bloom and Hypoxia Research and Control \n     Amendments Act of 2014; jointly to the Committees on Natural \n     Resources and Science, Space, and Technology.\n", "kind": "Unknown", "speaker": "Unknown", "itemno": 0, "turn": -1}, {"kind": "linebreak", "speaker_bioguide": null, "text": "                          ____________________\n\n\n", "turn": -1, "speaker": "None", "itemno": 1}], "header": {"chamber": "House", "num": "181", "extension": false, "year": "2017", "vol": "163", "pages": "H8594-H8595", "wkday": "Tuesday", "day": "7", "month": "November"}, "doc_title": "EXECUTIVE COMMUNICATIONS, ETC.", "id": "CREC-2017-11-07-pt1-PgH8594-3"}